{
  "fixture_id": "PHP-SQLI-001",
  "stack_id": "php-laravel-symfony",
  "synthetic": true,
  "license": "MIT",
  "contains_real_credentials": false,
  "contains_production_data": false,
  "source_provenance": "authored-for-evaluation",
  "allowed_execution": false,
  "safe_fix_mode": "not-applicable",
  "safe_fix_required": false
}
