{
  "fixture_id": "DEVOPS-DOCKER-KUBERNETES-FIX-001",
  "stack_id": "devops-docker-kubernetes",
  "synthetic": true,
  "license": "MIT",
  "contains_real_credentials": false,
  "contains_production_data": false,
  "source_provenance": "authored-for-evaluation",
  "allowed_execution": true,
  "safe_fix_mode": "not-applicable",
  "safe_fix_required": false
}
