{
  "fixture_id": "ANDROID-WEBVIEWFILEACCESS-001",
  "stack_id": "android-master",
  "synthetic": true,
  "license": "MIT",
  "contains_real_credentials": false,
  "contains_production_data": false,
  "source_provenance": "authored-for-evaluation",
  "allowed_execution": false,
  "safe_fix_mode": "not-applicable",
  "safe_fix_required": false
}
